{
	"slug": "team-stability",
	"label": "Scale-up SaaS B2B",
	"title": "Quand la croissance fragmente l'équipe Produit : recréer de la clarté, du rythme et de la cohérence.",
	"description": "Une équipe Produit en surcharge constante, des PMs qui compensent, un leadership flou. Comment remettre tout le monde sur les bons rails sans tout restructurer ?",
	"heroIntro": "Dans une scale-up SaaS B2B en forte accélération, l'équipe Produit perd progressivement sa cohésion. Les priorités changent trop vite, les PMs compensent, la dette d'ambiguïté explose. Voici comment nous avons rétabli un système de décision stable."
}

