{
	"slug": "conversation",
	"label": "Social Discovery App",
	"title": "Briser le plateau de rétention : De l'acquisition à l'engagement durable.",
	"description": "Comment débloquer une rétention stagnante à 15% alors que l'acquisition explose ? Une intervention centrée sur l'impact et l'activation conversationnelle.",
	"heroIntro": "Comment redresser une courbe de rétention plate (15%) alors que l'acquisition explose ? Analyse d'un sauvetage produit centré sur l'impact."
}

