{
	"slug": "onboarding-activation",
	"label": "SaaS B2B",
	"title": "Réparer l'activation : comment un onboarding surchargé bloquait toute la valeur perçue.",
	"description": "Dans un SaaS B2B, la majorité des utilisateurs n'atteignaient jamais la valeur du produit. Voici comment un travail d'activation ciblé a débloqué l'usage réel.",
	"heroIntro": "Malgré une acquisition solide, l'activation restait très faible : seuls 22% des utilisateurs atteignaient la valeur clé. L'onboarding était trop long, trop complet, trop théorique. Nous avons reconstruit une activation centrée sur le comportement, pas sur les fonctionnalités."
}

